{
  "id": "inferno_pack_common",
  "description": "Slice 1 Inferno pack/boss shared table — D2-style weights; server rolls seed+affixes",
  "rolls": 1,
  "no_drop_weight": 40,
  "champion_bonus_rolls": 1,
  "entries": [
    { "weight": 45, "rarity": "normal", "item_pool": "inferno_bases_t1", "qty_min": 1, "qty_max": 1 },
    { "weight": 28, "rarity": "magic", "item_pool": "inferno_affix_magic_t1", "qty_min": 1, "qty_max": 1 },
    { "weight": 14, "rarity": "rare", "item_pool": "inferno_affix_rare_t1", "qty_min": 1, "qty_max": 1 },
    { "weight": 6, "rarity": "set", "item_pool": "inferno_set_t1", "qty_min": 1, "qty_max": 1 },
    { "weight": 3, "rarity": "unique", "item_pool": "inferno_unique_t1", "qty_min": 1, "qty_max": 1 },
    {
      "weight": 1,
      "rarity": "canto_unique",
      "item_pool": "season_canto_unique",
      "qty_min": 1,
      "qty_max": 1,
      "soulbound": true,
      "season_only": true
    }
  ],
  "boss_guaranteed": [
    { "rarity": "rare", "item_pool": "inferno_affix_rare_t1" },
    { "rarity": "unique", "item_pool": "inferno_unique_t1", "soulbound": false }
  ]
}
